{"contract_version":"1.0.0","identity":{"recommendation_id":"REC-11111111111111111111111111111111","recommendation_key":"RCK-B221BE3D3DBC757E9FD394930157F16E2098D539CB244DC70A5899232ED9D33E","execution_id":"EXE-11111111111111111111111111111111","run_id":"RUN-11111111111111111111111111111111","task_id":"TSK-11111111111111111111111111111111","agent_role":"quality"},"recommendation":{"action":"HOLD_BATCH","severity":"HIGH","confidence":0.91,"evidence_refs":["inspection:731","batch:B17"],"reason_codes":["CONSECUTIVE_DEFECTS"],"output_artifact_refs":[]},"details":{"consecutive_defect_suspected":true},"generated_at":"2026-08-18T08:00:00.000000Z"}
