{"contract_version":"1.0.0","identity":{"recommendation_id":"REC-22222222222222222222222222222222","recommendation_key":"RCK-3C2D9E76B7E973F458AE9142481B0C550E816DE537591B56A9A64B89505CDE36","execution_id":"EXE-22222222222222222222222222222222","run_id":"RUN-11111111111111111111111111111111","task_id":"TSK-22222222222222222222222222222222","agent_role":"production"},"recommendation":{"action":"PASS","severity":"LOW","confidence":0.88,"evidence_refs":["batch:B17","line:L1"],"reason_codes":["NO_CAPACITY_IMPACT"],"output_artifact_refs":[]},"details":{"estimated_delay_minutes":0,"estimated_downtime_minutes":0,"affected_order_refs":[]},"generated_at":"2026-08-18T08:00:01.000000Z"}
