{"contract_version":"1.0.0","identity":{"recommendation_id":"REC-33333333333333333333333333333333","recommendation_key":"RCK-01DC0B2680471E5CF4112168CD8A2ECF83C35E2A1445173563375B0C652A2277","execution_id":"EXE-33333333333333333333333333333333","run_id":"RUN-11111111111111111111111111111111","task_id":"TSK-33333333333333333333333333333333","agent_role":"sla"},"recommendation":{"action":"HOLD_BATCH","severity":"MEDIUM","confidence":0.82,"evidence_refs":["order:O1","sla:S1"],"reason_codes":["DEFECT_ESCAPE_COST"],"output_artifact_refs":["artifact:sla-analysis-1"]},"details":{"expected_cost":120.0,"currency":"USD","alternative_costs":{"RECHECK":20.0,"STOP_LINE":430.0,"PASS":2000.0}},"generated_at":"2026-08-18T08:00:02.000000Z"}
